{
  "schema_version": "1",
  "kind": "evidence_event",
  "event_kind": "observation",
  "act_body_id": "sha256:00d48a7261addfc44b11e4afb6ad777bb8fb20b617e08c2e5d6a7f5923cfa309",
  "sequence": "3",
  "accepted_time": {
    "at": "2026-08-20T00:03:00Z",
    "authority": {
      "name": "authority:acceptor",
      "provenance": "synchronised"
    }
  },
  "detail": {
    "observed_tree_oid": "bbbbbbbbbbbbbbbbbbbbbbbbbbbbbbbbbbbbbbbb"
  }
}
